Shelter Name,Address,Website,ResultCard Description,ResultCard Description Full,Phone 1,Phone 2,Email,Map Link
Marc's Place,No  address available,N/A,"A safe house with three single rooms for street-involved or at-risk youth ages 13 to 15, not in Ministry of Children and Family Development (MCFD) care; all meals are provided.","A safe house with three single rooms for street-involved or at-risk youth ages 13 to 15, not in Ministry of Children and Family Development (MCFD) care; all meals are provided.A safe house with three single rooms for street-involved or at-risk youth ages 13 to 15, not in Ministry of Children and Family Development (MCFD) care; all meals are provided. Aim is to give the youth a positive, non-judgemental environment, assess their needs, and help them in making plans; may include mediation between the youth and their families and/or securing safety plans, or assistance in finding alternate family placements. A referral is required by a social worker who must gain permission from the youth's guardian; if the guardian cannot be reached, then the youth may be allowed to stay for three days under a MCFD take-charge order. Maximum stay is seven days. Pets cannot be accommodated. Facility is not wheelchair accessible. Transportation to the shelter is arranged through MCFD. Serves Vancouver and Richmond youth. 24-hour intake. Funded by MCFD.",604-261-7827,N/A,marcsplacesafehouse@gmail.com,/agency-details/marcs-place-9488948
Marshlands Shelter,"341 Fraser Avenue, Salmon Arm, BC V1E 1W3",https://shuswap-revelstoke.cmha.bc.ca,"Provides year-round, low-barrier, 24-hour emergency shelter in dorm rooms for 25 homeless adults.","Provided by Canadian Mental Health Association (CMHA) - Shuswap Revelstoke Branch13 other services offered by this agencyProvides year-round, low-barrier, 24-hour emergency shelter in dorm rooms for 25 homeless adults.Provides year-round, low-barrier, 24-hour emergency shelter in dorm rooms for 25 homeless adults. Provides access to daily meals, showers, laundry facilities, and a wellness circle. Storage space for belongings is available. Harm reduction focus; overdose prevention sites provide a place where people who use drugs can be safely monitored and treated immediately if they overdose. Intake is from 4 pm to 10:30 pm. Beds are allocated on a first come, first served basis. Open referral. Funded by BC Housing.",250-832-8477,N/A,info.sr@cmha.bc.ca,/result/marshlands-shelter-90114535
Merit Place Shelter,"725 Notre Dame, Kamloops, BC V2C 5N8",https://www.kamloops.cmha.bc.ca,"Provides year-round, low-barrier, 24-hour emergency housing in pods for 49 homeless adults of any gender.","Provided by Canadian Mental Health Association (CMHA) - Kamloops Branch18 other services offered by this agencyProvides year-round, low-barrier, 24-hour emergency housing in pods for 49 homeless adults of any gender.Provides year-round, low-barrier, 24-hour emergency housing in pods for 49 homeless adults of any gender. Services include meals, laundry facilities, life skills support, psychosocial support, and recovery-based support including access to AA and NA meetings. Health-related services include medication management, nursing support, wound care, physician and psychiatrist referrals, intensive case management, ACT (assertive community team) support, and other support services tailored to individual needs. Outreach services include shuttle transport, referral to community services, and street outreach from 2 pm to 10 pm Monday to Friday. Storage space for bicycles is available. Pets are allowed. Harm reduction focus; overdose prevention site provides a place where people who use drugs can be safely monitored and treated immediately if they overdose. Beds are allocated on a first-come, first-served basis. Accepts referral from self or other. Intake is 24 hours; administration hours are 9 am to 4 pm Monday to Friday. No prescribed maximum stay. Shelter is wheelchair accessible. Funded by BC Housing, Interior Health, and the City of Kamloops.",236-425-0341,N/A,meritplace.shelter@cmha.bc.ca,/result/merit-place-shelter-76790606
Metson Shelter,"1060 Howe Street, Vancouver, BC V6Z 1P5",https://communitybuilders.ca/our-sites/metson-rooms,Low-barrier shelter provides 38 beds in dorm rooms for homeless adults of all genders age 19 and older.,"Provided by Community Builders Group11 other services offered by this agencyLow-barrier shelter provides 38 beds in dorm rooms for homeless adults of all genders age 19 and older.Low-barrier shelter provides 38 beds in dorm rooms for homeless adults of all genders age 19 and older. Services include meals and snacks, showers, and laundry facilities. Intake hours are 11 am to 4 pm Monday to Friday. Pets are allowed on a leash or in a cage. Shopping carts can be accommodated. Partially accessible, as this is a mat program; no supports. Open 24 hours a day, seven days a week.",604-428-3686,N/A,metson@communitybuilders.ca,/result/metson-shelter-53646580
Moira House,"600 Kingston Avenue, Kamloops, BC V2B 2C8",https://www.kamloops.cmha.bc.ca,"Provides year-round, 24-hour recovery-focused emergency shelter in single room occupancy units for 41 homeless adults of any gender.","Provided by Canadian Mental Health Association (CMHA) - Kamloops Branch18 other services offered by this agencyProvides year-round, 24-hour recovery-focused emergency shelter in single room occupancy units for 41 homeless adults of any gender.Provides year-round, 24-hour recovery-focused emergency shelter in single room occupancy units for 41 homeless adults of any gender. Services include daily warm meals, showers, laundry facilities, personal hygiene products, clothing, first aid, and access to local calling. Other services include advocacy, referral, follow-up, crisis counselling, case planning, and wellness and life skills development. Health-related services include 24-access to bed rest, medication storage, access to nursing support through referral to external services, home care through referral to external services, and other services. Storage space is not available. Pets are allowed. Accepts inebriated individuals on condition of respectful behaviour. Violence will not be tolerated. Smoking permitted in designated areas. Referral accepted from self or other. No prescribed maximum stay. Wheelchair accessible. Funded by BC Housing.",250-312-2954,N/A,moira.house@cmhakamloops.ca,/result/moira-house-78561211
Multicultural Helping House Society (MHHS),"4802 Fraser Street, Vancouver, BC V5V 4H4",https://www.helpinghouse.org,Aims to help newcomers succeed in Canada.,"1 service offered by this service providerAims to help newcomers succeed in Canada.Aims to help newcomers succeed in Canada. Helps immigrants and refugees from diverse ethnic and socio-economic backgrounds by providing educational, social, emotional, economic, and other support services. Services include information and referral, settlement services, parenting and leadership skills training, advocacy, online and in-person programs for youth and seniors, cultural activities, volunteer placement, and a tax clinic. Provides emergency housing for live-in caregivers in crisis and transient new immigrants (such as foreign workers) of all genders for a few days while they look for housing. Crisis financial assistance may be available for live-in caregivers and seniors. Services are offered in multiple languages: Cantonese, Farsi, Filipino, Hindi, Ibanag, Ilocano, Kapampangan, Pangasinan, Punjabi, Russian, Spanish, Tagalog, Visaya. Also offers a seniors program with digital literacy and community engagement activities at the office, every Saturday from 1:30pm to 3:30pm. Office and program hours are 9 am to 5 pm Monday to Friday. Nonprofit society, registered charity.",604-359-1809,N/A,info@helpinghouse.org,/agency-details/multicultural-helping-house-society-mhhs-9488674
Nawican Emergency Homeless Shelter,"1401 102nd Avenue, Dawson Creek, BC V1G 2E2",https://nawican.ca,"Provides year-round, low-barrier overnight emergency housing in men's and women's dormitories for 17 homeless adults, including transgender individuals.","Provided by Dawson Creek Nawican Friendship Centre2 other services offered by this agencyProvides year-round, low-barrier overnight emergency housing in men's and women's dormitories for 17 homeless adults, including transgender individuals.Provides year-round, low-barrier overnight emergency housing in men's and women's dormitories for 17 homeless adults, including transgender individuals. Services include hot meals, snacks and coffee, showers, laundry facilities, access to computers and internet, personal hygiene products, clothing, first aid, advocacy, transportation, and referrals to mental health and/or addiction resources. Harm reduction focus; accepts inebriated individuals on condition of respectful behaviour. Provides opioid users with free Take Home Naloxone Kits (Narcan) that can be used to reverse the effects of overdoses from opioids like fentanyl, heroin, methadone, morphine, and oxycodone. Storage lockers are available. Pets are not allowed. Shelter and intake hours are 4:30 pm to 9:30 pm daily; beds are allocated on a first-come, first-served basis. Clients can call ahead or check in at the shelter by 10 pm for bed availability. Curfew is 10:30 pm; clients who have completed intake are encouraged to be at the shelter by curfew or their bed may be given away. If there are no beds available or the client cannot be accepted due to safety or health concerns, the shelter will assist them in finding a safe alternative, arranging transportation, or contacting the hospital. Referral accepted from self or other. Maximum stay is 14 days. Also provides a warming space during extreme weather where people living outside can take refuge from the cold. Shelter is wheelchair accessible.",778-843-1722,250-782-5202,nfcehs@nawican.ca,/result/nawican-emergency-homeless-shelter-77902902
New Fountain Shelter,"356 East Hastings Street, Vancouver, BC V6A 1P4",https://www.phs.ca,"Provides year-round, low-barrier, overnight emergency housing for 60 homeless adults age 25 and over from 7 pm to 9 am; shelter for all gender individuals, with a separate space for self-identified women.","Provided by PHS Community Services Society31 other services offered by this agencyProvides year-round, low-barrier, overnight emergency housing for 60 homeless adults age 25 and over from 7 pm to 9 am; shelter for all gender individuals, with a separate space for self-identified women.Provides year-round, low-barrier, overnight emergency housing for 60 homeless adults age 25 and over from 7 pm to 9 am; shelter for all gender individuals, with a separate space for self-identified women. Services include advocacy, information and referral, outreach, and by-donation clothing available from 7 pm to 12 midnight. Other services include a nurse and social worker. Provides dinner, breakfast, and a bagged lunch. Health services include medication storage, home nursing onsite (must be a Downtown Community Health Centre client or not connected with any other clinic) with oxygen tanks permitted. Storage locker space for carts and other belongings is available. Pets are allowed. Priority is given to returning guests; returning clients must show up before 10 pm to keep a bed. Beds are allocated on a first-come, first-served basis and can be done anytime if space allows. Shelter does not keep a waitlist. Wheelchair accessible.",604-669-3306,604-723-5637,info@phs.ca,/result/new-fountain-shelter-9508728
New Hope Centre Emergency Shelter,"New Hope Centre, 19 Nicol Street,Nanaimo, BC V9R 4S6",https://nanaimosa.ca/new-hope-centre,"Provides year-round, 24-hour emergency accommodation in beds for 24 men (cisgender and transgender) ages 19 and up.","Provided by The Salvation Army - BC Division221 other services offered by this agencyProvides year-round, 24-hour emergency accommodation in beds for 24 men (cisgender and transgender) ages 19 and up.Provides year-round, 24-hour emergency accommodation in beds for 24 men (cisgender and transgender) ages 19 and up. Services include meals, showers, laundry, and personal support. Men are connected with a one-to-one caseworker. Pets cannot be accommodated. Storage space is limited. Length of stay in the emergency shelter is 30 days. People may be admitted when intoxicated on condition of respectful behaviour, but cannot use on the premises; violence will not be tolerated. Priority is given to returning guests; curfew is 11 pm. Open referral; intake is from 8 am to 5 pm daily; beds are allocated on a first-come, first-served basis. Opportunity to move to transitional housing for up to one year. Wheelchair accessible. Funded in part by BC Housing.",250-714-1142,N/A,NanaimoNHC.Hope@salvationarmy.ca,/result/new-hope-centre-emergency-shelter-69488921
New Westminster Homeless Shelter,"502 Columbia Street , New Westminster, BC V3L 1B1",https://www.purposesociety.org,Low-barrier shelter providing 40 beds for men and 10 beds for women experiencing homelessness; can accommodate couples as needed.,"Provided by Lower Mainland Purpose Society for Youth and Families30 other services offered by this agencyLow-barrier shelter providing 40 beds for men and 10 beds for women experiencing homelessness; can accommodate couples as needed.Low-barrier shelter providing 40 beds for men and 10 beds for women experiencing homelessness; can accommodate couples as needed. Access to the shelter is on Front Street. Uses a bed reservation system to avoid line-ups. Services include daily meals and referral to health, harm reduction, and other services at Purpose Society’s main building (40 Begbie Street). Shelter hours are 8 pm to 8 am, seven days a week. Storage space is not available. Pets are allowed. Not wheelchair accessible. Funded by BC Housing.",604-375-5792,N/A,mail@purposesociety.org,/result/new-westminster-homeless-shelter-81392084
Nicola Valley Shelter and Support Society,"2038 Nicola Avenue, Merritt, BC V1K 1L8",https://www.nvshelterandsupport.com,Offers services to individuals and families in the Nicola Valley who are homeless or at risk of becoming homeless.,"1 service offered by this service providerOffers services to individuals and families in the Nicola Valley who are homeless or at risk of becoming homeless.Offers services to individuals and families in the Nicola Valley who are homeless or at risk of becoming homeless. Through the Housing First (Reaching Home COVID-19 Emergency Response) program, provides intensive case management and support to marginalized individuals with mental health and/or addiction issues who are chronically homeless or at risk of homelessness. The Endeavor to be Better program offers peer mentorship to support people experiencing challenges involving mental health and/or substance use. Office hours are 8 am to 4 pm Monday to Friday. Nonprofit society.",250-315-0155,N/A,nvsss@shaw.ca,/agency-details/nicola-valley-shelter-and-support-society-53107699
North Shore Housing Centre - Shelter,"705 West 2nd Street, North Vancouver, BC V7M 1E6",https://www.lookoutsociety.ca,The North Shore Shelter is a short-term shelter with up to 45 beds for North Shore adults over 18 years of age who have no other housing options.,"Provided by Lookout Housing and Health Society69 other services offered by this agencyThe North Shore Shelter is a short-term shelter with up to 45 beds for North Shore adults over 18 years of age who have no other housing options.The North Shore Shelter is a short-term shelter with up to 45 beds for North Shore adults over 18 years of age who have no other housing options. 24-hour staff address housing, financial, and mental/physical health and addiction issues through crisis intervention, case planning, and referral/liaison services. Meals are provided. Health-related services include 24-hour access to bed rest (doctor's note required), and administration of medication with prescription. Pets are welcome. Wheelchair accessible. Clients must call first or be referred. Also offers 25 co-located, transitional housing suites for those who are already regular habitants of the shelter; see separate listing for details. The Homeless Outreach Program provides advocacy support, referrals, and housing search assistance for people who are homeless, at risk of becoming homeless, or difficult to house. Serves Bowen Island, District of North Vancouver, City of North Vancouver, and District of West Vancouver. Staff also work collaboratively with other areas as applicable. Office hours are 9 am to 5 pm Monday to Friday. Wheelchair accessible. Funded by BC Housing.",604-982-9126,N/A,nsshelter@lookoutsociety.ca,/result/north-shore-housing-centre-shelter-9506940
North Shore Youth Safe House,No  address available,https://hollyburn-society.ca/youth-homelessness-life-success-wired-4-success-employment-north-shore/safe-house,"Short-term emergency housing and support services for up to four youth of all genders, ages 13 to 18, who may be homeless or needing a break from a stressful family situation (including unsafe and dangerous situations); stay is up to 14 days (which in some cases can be extended) with 24-hour staffing and an enforced housing curfew.","Provided by Hollyburn Family Services16 other services offered by this agencyShort-term emergency housing and support services for up to four youth of all genders, ages 13 to 18, who may be homeless or needing a break from a stressful family situation (including unsafe and dangerous situations); stay is up to 14 days (which in some cases can be extended) with 24-hour staffing and an enforced housing curfew.Short-term emergency housing and support services for up to four youth of all genders, ages 13 to 18, who may be homeless or needing a break from a stressful family situation (including unsafe and dangerous situations); stay is up to 14 days (which in some cases can be extended) with 24-hour staffing and an enforced housing curfew. Includes nutritious meals, shared rooms, showers, and laundry facilities. Services also include counselling, family mediation, information and referral, clothing, bus tickets for appointments, and help with income assistance, youth agreements, and educational opportunities. After-care support is also provided with the aim to help youth return to their home safely or to an alternate living environment. Accepts referral from self or other, though does not accept youth who are using drugs or alcohol, detoxing or have severe mental health issues; youth must be able to care for themselves and not be a risk to themselves or others. Not wheelchair accessible; cannot accommodate pets. Serves youth from the North Shore and Sea-to-Sky areas, and elsewhere if beds are available.",604-924-8005,1-877-78YOUTH (1-877-789-6884),nsysh@hollyburnsociety.ca,/result/north-shore-youth-safe-house-29783204
Northern Centre of Hope Emergency Shelter,"9824 99th Avenue, Fort St John, BC V1J 5A5",https://www.safsj.org,"A year-round, 24-hour emergency shelter with up to 30 beds for adults age 19 and older of any gender.","Provided by The Salvation Army - BC Division221 other services offered by this agencyA year-round, 24-hour emergency shelter with up to 30 beds for adults age 19 and older of any gender.A year-round, 24-hour emergency shelter with up to 30 beds for adults age 19 and older of any gender. Services include three meals per day, laundry facilities, lockers, referrals, advocacy, and outreach. Maximum length of stay for beds is determined on a case-by-case basis. No alcohol or drug use or smoking allowed inside the building. Pets can be accommodated on a case-by-case situation. No storage of bikes or carts inside, but they can be locked to a bike shed outside. Wheelchair accessible. Funded by BC Housing.",250-785-0372,N/A,erin.ferris@salvationarmy.ca,/result/northern-centre-of-hope-emergency-shelter-9510269
Older Adults Shelter,"Central Heights Church, 1661 McCallum Rd,Abbotsford, BC V2S 3M4",N/A,Year-round emergency 18-bed shelter for older adults of any gender.,"Provided by Sparrow Community Care SocietyYear-round emergency 18-bed shelter for older adults of any gender.Year-round emergency 18-bed shelter for older adults of any gender. Staffed 24 hours. No pets; not wheelchair accessible. No alcohol or drug use on site; accepts inebriated individuals on condition of respectful behaviour. Provides three meals per day, showers, access to laundry, and personal hygiene supplies. Must be able to use bathroom independently. Must manage own medication and bathing, or arrange for supports through home health. Provides rides for doctor appointments.",604-991-6937,N/A,N/A,/result/older-adults-shelter-88374147
Olive Branch Transitional Shelter,"10732 City Parkway, Surrey, BC V3T 4C7",https://www.sumsplace.ca/shelters,Emergency shelter space for those transitioning into recovery or permanent housing includes 44 beds separated into three dorms with 35 beds for males and nine beds for females.,"Provided by Surrey Urban Mission Society (SUMS)13 other services offered by this agencyEmergency shelter space for those transitioning into recovery or permanent housing includes 44 beds separated into three dorms with 35 beds for males and nine beds for females.Emergency shelter space for those transitioning into recovery or permanent housing includes 44 beds separated into three dorms with 35 beds for males and nine beds for females. Services include meals, laundry, and showers, and access to shelter support services, and overdose prevention site, and a Managed Alcohol Program (MAP). Pets are allowed. No storage space available for carts, bicycles, or belongings. Wheelchair accessible. Intake through Surrey Welcome Hub at 13545 King George Boulevard. Optimum time to call regarding availability of space is 8:30 am to 4:30 pm Monday to Friday.",604-585-0259,604-585-1023,info@sumsplace.ca,/result/olive-branch-transitional-shelter-70563401
Our Place Community Center - Overnight Shelter,"919 Pandora Avenue, Victoria, BC V8V 3P4",https://www.ourplacesociety.com/how-we-help/housing,"Overnight year-round shelter that can accommodate 34 adults, age 19 and older of any gender; operates from 7:30 pm to 6:20 am daily.","Provided by Our Place Society14 other services offered by this agencyOvernight year-round shelter that can accommodate 34 adults, age 19 and older of any gender; operates from 7:30 pm to 6:20 am daily.Overnight year-round shelter that can accommodate 34 adults, age 19 and older of any gender; operates from 7:30 pm to 6:20 am daily. For intake, call or sign up in person starting at 7 am for that night at the front desk. Clients must arrive no later than 8:30 pm to confirm that a space is available. After 8:30 pm available beds will be assigned on a first-come, first-served basis to individuals who are on the waitlist. Clients will have secure beds for the next night if they do not lapse in attendance. Sandwiches are available in the evening, and coffee and tea and snacks in the morning. No pets allowed. Wheelchair accessible.",250-388-7112 Local 1222,N/A,housingprogram@ourplacesociety.com,/result/our-place-community-center-overnight-shelter-53438958
Out of the Rain Youth Shelter (OOTR),"1450 Elford Street, Victoria, BC V8S 3S8",https:// www.beaconcs.ca,"Year-round, low barrier emergency shelter providing 15 beds for homeless youth of all genders, ages 15 to 25.","Provided by Beacon Community Services46 other services offered by this agencyYear-round, low barrier emergency shelter providing 15 beds for homeless youth of all genders, ages 15 to 25.Year-round, low barrier emergency shelter providing 15 beds for homeless youth of all genders, ages 15 to 25. Staff can provide information and community referrals to other support services. Hours are 8:30 pm to 7:30 am seven days a week, with an 2 am curfew. An evening meal and cold breakfast to go provided. Pets accepted, if well behaved. Wheelchair accessible.",250-415-3856,250-415-9469,outoftherain@beaconcs.ca,/result/out-of-the-rain-youth-shelter-ootr-9507322
Parkway Shelter,"10666 City Park Way, Surrey, BC V3T 4C7",N/A,"A low-barrier, shelter for homeless adults; 28 beds for men, and 12 mats for women.","Provided by Lookout Housing and Health Society69 other services offered by this agencyA low-barrier, shelter for homeless adults; 28 beds for men, and 12 mats for women.A low-barrier, shelter for homeless adults; 28 beds for men, and 12 mats for women. Operates in conjunction with the The Front Room, a 24-hour drop-in resource centre. Provides laundry, showers, and meals. Pets are welcome. Wheelchair accessible. No shopping carts. Operated in partnership with and funded by BC Housing.",604-582-0408,N/A,parkway@lookoutsociety.ca,/result/parkway-shelter-44865460
Pathways Emergency Shelter,"46130 Margaret Avenue, Chilliwack, BC V2P 6J4",https://www.ranmission.ca ,Offers overnight emergency shelter on mats to 45 adults ages 19 and over.,"Provided by Ruth and Naomi’s (RAN) Mission6 other services offered by this agencyOffers overnight emergency shelter on mats to 45 adults ages 19 and over.Offers overnight emergency shelter on mats to 45 adults ages 19 and over. Services include daily meals at 8 am, 12 noon, and 6 pm; clothing; access to showers and laundry; and referrals to community services. Offers an Opioid Prevention Service (OPS) in a room for people smoking or injecting hard drugs; the building is otherwise alcohol/drug free. Marijuana or tobacco cigarettes can be smoked in the outside smoking area. Check-in starts at 8:30 pm; mats are allocated on a first-come, first-serve basis. Shelter operates 24 hours, but guests are asked not to go in and out between 11:30 pm and 7:30 am. Locked storage space for bicycles is available. Wheelchair accessible. No pets allowed. Referrals accepted from self or other.",604-795-2322 Local 401,N/A,info@ruthandnaomis.ca,/result/pathways-emergency-shelter-59769818
