Shelter Name,Address,Website,ResultCard Description,ResultCard Description Full,Phone 1,Phone 2,Email,Map Link
Directions Youth Shelter,"1138 Burrard Street, Vancouver, BC V6Z 1Y7",https://www.directionsyouthservices.ca/youth-services-centre,"Emergency shelter provides 12 beds to youth ages 19 to 24 of all genders who are homeless, street entrenched, or at risk of homelessness.","Provided by Family Services of Greater Vancouver (FSGV)52 other services offered by this agencyEmergency shelter provides 12 beds to youth ages 19 to 24 of all genders who are homeless, street entrenched, or at risk of homelessness.Emergency shelter provides 12 beds to youth ages 19 to 24 of all genders who are homeless, street entrenched, or at risk of homelessness. There is a draw for available beds at 8 pm each night; intake is required ahead of time if youth are not already clients receiving FSGV services. Shelter hours are 9 pm to 9 am, seven days a week; curfew is 11 pm. Low-barrier shelter; substance use not permitted in shelter, but youth can come in when under the influence. Services include laundry facilities, showers, clothing, toiletries, one-to-one peer counselling, an on-staff clinical counsellor, information and referral, and hot meals. There is limited accommodation for up to four pets that will be kennelled separately from the shelter. Not fully accessible, as this is a bunk program. Also operates an extreme weather response shelter between October 15 and April 15 when weather is extreme.",604-633-1472 Local 1,N/A,N/A,/result/directions-youth-shelter-43132995
Douglas Street Community - Arbutus Shelter,"Basement-2915 Douglas Street, Victoria, BC V8T 4M8",https://www.phs.ca/locations/arbutus-shelter,"Low-barrier, 24-hour shelter with 39 beds in both co-ed and women's-only (trans-inclusive) sections; also offer emergency mats for additional shelter, when available.","Provided by PHS Community Services Society31 other services offered by this agencyLow-barrier, 24-hour shelter with 39 beds in both co-ed and women's-only (trans-inclusive) sections; also offer emergency mats for additional shelter, when available.Low-barrier, 24-hour shelter with 39 beds in both co-ed and women's-only (trans-inclusive) sections; also offer emergency mats for additional shelter, when available. Provides three meals a day, shower facilities, and limited secure storage for personal items including bikes and shopping carts. Wheelchair accessible. Pets are welcome. Intake is from 5 pm; waitlist opens at 8 am.  Funded by BC Housing.",250-360-0093,604-683-0073,N/A,/result/douglas-street-community-arbutus-shelter-53488758
Elizabeth Gurney House,No  address available,https://efry.com,"Provides year-round, low barrier, 24-hour emergency housing for women (cisgender and transgender) with or without children, who are homeless and without resources in New Westminster.","Provided by Elizabeth Fry Society of Greater Vancouver28 other services offered by this agencyProvides year-round, low barrier, 24-hour emergency housing for women (cisgender and transgender) with or without children, who are homeless and without resources in New Westminster.Provides year-round, low barrier, 24-hour emergency housing for women (cisgender and transgender) with or without children, who are homeless and without resources in New Westminster. Accepts children up to age 18. Services include meals, basic necessities, laundry facilities, and crisis intervention. Also offers life-skills training and one-to-one support with housing, legal, and social service issues. Health-related services include supports through referral. Capacity is 12 beds; families are housed in one room and singles share a room. No substance use is permitted on the premises, and all medication must be turned over to staff. Referral accepted from self or other; a short screening assessment is done prior to intake. Pets are not allowed. Wheelchair accessible.",604-524-0710,N/A,N/A,/result/elizabeth-gurney-house-9506624
Emerald Centre,"271 Victoria Street West, Kamloops, BC V2C 1A5",https://www.kamloops.cmha.bc.ca/programs-services/homeless-shelter,"A co-ed, low-barrier shelter that provides 40 beds to members of the community who are experiencing homelessness; accepts all genders.","Provided by Canadian Mental Health Association (CMHA) - Kamloops Branch18 other services offered by this agencyA co-ed, low-barrier shelter that provides 40 beds to members of the community who are experiencing homelessness; accepts all genders.A co-ed, low-barrier shelter that provides 40 beds to members of the community who are experiencing homelessness; accepts all genders. 24-hour shelter that operates daily, year-round. Clients are provided with a clean bed, meals, and access to support workers, plus a case management team that works with them to help access available services and find stable housing. Offers education on safe drug use and incorporates harm reduction services for people who use substances, including distributing supplies for safe drug use and referring clients to additional support programs and services. Funded by BC Housing.",250-372-3031,N/A,emerald.centre@cmha.bc.ca,/result/emerald-centre-9509995
Emergency Shelter - Powell River (qathet),"4746 Joyce Avenue, Powell River, BC V8A 3B6",https://www.liftcommunityservices.org,"Year-round, 24-hour low-barrier emergency shelter provides 20 beds for homeless adults of any gender.","Provided by LIFT Community Services16 other services offered by this agencyYear-round, 24-hour low-barrier emergency shelter provides 20 beds for homeless adults of any gender.Year-round, 24-hour low-barrier emergency shelter provides 20 beds for homeless adults of any gender. Provides daily meals, resource navigation, harm reduction supplies, laundry facilities, and connection to community supports. Intake starts at 4 pm daily; beds available on a first-come, first-served basis. Separate rooms are available for women and gender diverse individuals. Storage space is available. Pets are allowed. Not wheelchair accessible. Funded by BC Housing.",604-578-0633,N/A,housingservices@liftcommunityservices.org,/result/emergency-shelter-powell-river-qathet-59411672
Emergency Shelter for Men,"601 East Hastings Street, Vancouver, BC V6A 1J7",https://www.ugm.ca,"Provides a clean, safe, sober environment for up to 92 self-identified men from 9 pm to 6:50 am daily.","Provided by Union Gospel Mission (UGM)16 other services offered by this agencyProvides a clean, safe, sober environment for up to 92 self-identified men from 9 pm to 6:50 am daily.Provides a clean, safe, sober environment for up to 92 self-identified men from 9 pm to 6:50 am daily. Consists of five separate rooms with bunk beds. Tickets to reserve spot on the waitlist are handed out at 5 pm at reception. Intake occurs on a first-come, first-served basis, and begins at 9 pm at the Cornerstone Drop-In Centre (entrance on Princess Street). Offers showers, limited laundry facilities, case management, and referrals to housing, recovery, legal, and immigration services. Bible devotions, spiritual supports, and prayer are available. Individuals must be able to access services independently as there are no one-on-one or medical supports. Does not accept pets (licensed guide dogs allowed). Does not have cart or baggage storage. Wheelchair accessible.",604-253-3323,N/A,ugm@ugm.ca,/result/emergency-shelter-for-men-9493731
Evelyne Saller Temporary Winter Response Shelter,"404 Alexander Street, Vancouver, BC V6A 1C6",N/A,"Provides seasonal, low-barrier, overnight emergency housing on mats for 42 homeless adults from November 1st to April 30th.","Provided by City of Vancouver42 other services offered by this agencyProvides seasonal, low-barrier, overnight emergency housing on mats for 42 homeless adults from November 1st to April 30th.Provides seasonal, low-barrier, overnight emergency housing on mats for 42 homeless adults from November 1st to April 30th.  Shelter hours are 11 pm to 7:30 am Monday to Friday, and 10 pm to 7:30 am Saturdays and Sundays. Mats are allocated on a first-come, first-served basis. Please call first. Community members can register for a mat, in person only, with the Shelter Coordinator. Guests must be physically able to get on and off the mats without any physical assistance. If registered patrons do not arrive by 11:15 pm Monday to Friday, or 10:15 pm Saturday and Sunday, their mat will be given away, for that night, on a first come first served basis to unregistered folks waiting outside. If registered patrons do not show up two nights in a row, they will lose their reserved mat. No admittance after 1 am. Evening snack and morning snack and meal ticket provided. Storage space for carts is not available. Pets are not allowed. Shelter is wheelchair accessible however guests must transfer to and from their mats independently.",604-665-3075,N/A,N/A,/result/evelyne-saller-temporary-winter-response-shelter-82058815
Evergreen Emergency Shelter,"690 Evergreen Road, Campbell River, BC V9W 3R8",https://www.oceancrestchurch.org/serving-campbell-river,"Provides year-round, low-barrier, 24-hour emergency housing for 22 adults of all genders experiencing homelessness.","Provided by The Salvation Army - BC Division221 other services offered by this agencyProvides year-round, low-barrier, 24-hour emergency housing for 22 adults of all genders experiencing homelessness.Provides year-round, low-barrier, 24-hour emergency housing for 22 adults of all genders experiencing homelessness. Services include breakfast and dinner daily as well as lunch on the weekends. Other services include laundry, hygiene supplies, information, and referrals to community services. Health-related services include harm reduction information and supplies. Also offers medication storage but staff cannot administer. Provides limited storage space including a bike rack. Pets are allowed on a case-by-case basis. People may be admitted when intoxicated, but cannot use on the premises, must be medically independent, and must agree to behavioural guidelines. Referral accepted from self or other. Shelter is not wheelchair accessible.",250-287-3791,N/A,evergreenshelter@oceancrestchurch.org,/result/evergreen-emergency-shelter-9508506
Extreme Weather Response (EWR) Program,No  address available,https://www.bchousing.org/housing-assistance/homelessness-services/emergency-shelter-program,Provides individuals and families in need with temporary shelter beds during extreme weather conditions between November 1st through to March 31st.,"Provided by BC Housing33 other services offered by this agencyProvides individuals and families in need with temporary shelter beds during extreme weather conditions between November 1st through to March 31st.Provides individuals and families in need with temporary shelter beds during extreme weather conditions between November 1st through to March 31st. Each community decides on a local basis when to issue an Extreme Weather Alert based on current conditions and local forecasts, determining when locations will be open, and the number of spaces available. Shelters remain open only for the duration of the Extreme Weather Alert. The online BC Shelter Map shows locations of EWR shelters across the province, and whether they are open or closed.",604-433-2218,1-800-257-7756,N/A,/result/extreme-weather-response-ewr-program-42387517
Father Poullet Shelter,"4903 48th Avenue, Fort Nelson, BC V0C 1R0",https://www.fnafs.org,Minimal barrier emergency shelter for men ages 19 and over with six beds and a refuge area.,"Provided by Fort Nelson Aboriginal Friendship Society10 other services offered by this agencyMinimal barrier emergency shelter for men ages 19 and over with six beds and a refuge area.Minimal barrier emergency shelter for men ages 19 and over with six beds and a refuge area. Provides snacks, food vouchers, clothing, toiletries, showers, and free off-site laundry services. Also provides information and referrals to community services, and case planning. Transportation to shelter and to appointments is available. Blankets are given to turnaways. Zero tolerance for alcohol and drug use. Intake and shelter operates 24 hours daily; clients are expected to vacate premises between 10 am and 3 pm for personal activities, except during extreme weather conditions or a crisis. Limited storage space. Pets cannot be accommodated. Not wheelchair accessible. Funded by BC Housing.",250-774-3816,250-774-2993,emergencyshelter.fnafs@northwestel.net,/result/father-poullet-shelter-9510019
First Unitarian Fellowship of Nanaimo,"1-595 Townsite Road, Nanaimo, BC V9S 1K9",https://www.ufon.ca/weather-shelter,Operates the year-round Nanaimo Unitarian Shelter emergency shelter with 25 beds for adults of all genders.,"Operates the year-round Nanaimo Unitarian Shelter emergency shelter with 25 beds for adults of all genders.Operates the year-round Nanaimo Unitarian Shelter emergency shelter with 25 beds for adults of all genders. Offers dinner and breakfast daily, laundry service, and other supports. Accepts pets. Hours are 5 pm to 7:30 am. Also open during the day for previous night's guests during extreme weather emergencies. Funded by BC Housing. Also operates a free shower program in partnership with City of Nanaimo at Caledonia Park (110 Wall Street) from 7 am to 12 noon Monday to Friday. Last shower starts at 11:30 am; towels and toiletries provided. Shower program funded by City of Nanaimo and Government of Canada.",250-754-3720,N/A,shelter@ufon.ca,/agency-details/first-unitarian-fellowship-of-nanaimo-41033839
First United Shelter Program,"467 Alexander Street, Vancouver, BC V6A 1C6",https://firstunited.ca,"Provides year-round, low-barrier, 24-hour emergency shelter for men and women, including who have substance use and/or mental health issues.","Provided by First United Church Community Ministry Society5 other services offered by this agencyProvides year-round, low-barrier, 24-hour emergency shelter for men and women, including who have substance use and/or mental health issues.Provides year-round, low-barrier, 24-hour emergency shelter for men and women, including who have substance use and/or mental health issues. Provides 25 beds for men, and 26 beds for women, ages 19 and up. Services include daily meals, showers and toiletries. People under the influence may be admitted, and substance use is not allowed inside the building or on the property. Violence is not tolerated. In-out access is allowed 24 hours a day. Pets are permitted on a case-by-case basis. Shelter residents are assigned one locker for the duration of their stay. Health-related services include 21-hour access to bed rest (24 hours with a note from a doctor or nurse), home nursing through referral, and home care through referral. Facility is wheelchair accessible.",604-839-6880,N/A,info@firstunited.ca,/result/first-united-shelter-program-9509838
Food for the Soul Project Society,"1-22335 Lougheed Highway, Maple Ridge, BC V2X 2T3",https://www.fftsp.org,Provides a variety of services for individuals age 18 and over with addictions or mental health issues in Maple Ridge and Abbotsford.,"2 services offered by this service providerProvides a variety of services for individuals age 18 and over with addictions or mental health issues in Maple Ridge and Abbotsford.Provides a variety of services for individuals age 18 and over with addictions or mental health issues in Maple Ridge and Abbotsford. Also assists those who are low income or experiencing homelessness. Services include primary care as well as groceries, clothing, housing and shelter referrals, and a volunteer-run support group for depression and/or anxiety. The Food for the Soul (OAT) Clinic provides a supportive, multidisciplinary, outpatient opioid substitution therapy program for individuals who use heroin or other opiates; offers assessment, long-term stabilization on methadone or suboxone, and withdrawal management. Clients may qualify for coverage or reimbursement. Also offers free addictions counselling. Staff speak English, Punjabi, and Farsi. Interpretation/translation services available. Clients can book appointments for addictions services online. Wheelchair accessible. Office and clinic hours are 9 am to 5 pm Monday to Friday, and 9 am to 4 pm on weekends, including statutory holidays. Nonprofit society, registered charity.",604-380-1608,N/A,info@fftsp.org,/agency-details/food-for-the-soul-project-society-65566274
Foxglove Shelter,"9810 Foxglove Drive, Surrey, BC V3T 4M5",https://www.raincityhousing.org/about/programs,"Provides low-barrier shelter rooms for adults (14 for male-identified individuals, 14 for female-identified individuals, and three for non-binary individuals) who are currently homeless or unstably housed.","Provided by RainCity Housing and Support Society49 other services offered by this agencyProvides low-barrier shelter rooms for adults (14 for male-identified individuals, 14 for female-identified individuals, and three for non-binary individuals) who are currently homeless or unstably housed.Provides low-barrier shelter rooms for adults (14 for male-identified individuals, 14 for female-identified individuals, and three for non-binary individuals) who are currently homeless or unstably housed. Daily meals and laundry facilities are available to all supportive housing and shelter residents. 24-hour support staff provide access to a medication program, overdose prevention services, and Indigenous cultural and peer supports. People accessing enhanced health supports will have access to on-site and in-reach clinical services provided by Fraser Health. No storage space available. Pets are accepted. Wheelchair accessible. Call between 7 am and 3 pm to be added to waitlist.",604-589-0496,N/A,kparker@raincityhousing.org,/result/foxglove-shelter-83207140
Fraserside Emergency Family Shelter,No  address available,https://www.fraserside.bc.ca/social-housing/emergency-family-shelter,"12-bed short-stay, communal living home for families with children and single self-identified women.","Provided by Fraserside Community Services Society21 other services offered by this agency12-bed short-stay, communal living home for families with children and single self-identified women.12-bed short-stay, communal living home for families with children and single self-identified women. Families can be two-parent families or single parents (men or women and their children); no single men. Includes meals and emergency clothing. Provides assistance with life and parenting skills as well as personal case planning and support with housing and community resources. No alcohol or drug use allowed. Not wheelchair accessible; pets not allowed. Call to arrange intake.",604-525-3929,N/A,info@fraserside.bc.ca,/result/fraserside-emergency-family-shelter-9492452
Friendship Lelum Aboriginal Youth Safe House,No  address available,https://www.tillicumlelum.ca/programs/youth,"Provides short-term, emergency shelter for youth ages 12 to 18 who are experiencing stressful situations and have been identified as at-risk.","Provided by Tillicum Lelum Aboriginal Friendship Centre15 other services offered by this agencyProvides short-term, emergency shelter for youth ages 12 to 18 who are experiencing stressful situations and have been identified as at-risk.Provides short-term, emergency shelter for youth ages 12 to 18 who are experiencing stressful situations and have been identified as at-risk. Works to promote a safe, secure, stable, and nurturing environment. Services include advocacy, referrals, and support. 24-hour shelter, with intake at any time, although pre-arranging an intake time is welcome. Maximum stay is two weeks, but can be extended if necessary. Accepts all genders; individual rooms are available if house isn't full. Indigenous-based programming, but open to all youth. Permission of legal guardian is required. Not able to accommodate pets. Limited storage space for bikes. Wheelchair accessible.",250-753-8266,N/A,N/A,/result/friendship-lelum-aboriginal-youth-safe-house-9509043
Gateway Shelter,"10667 135A Street, Surrey, BC V3T 4E3",https://www.lookoutsociety.ca,"A low-barrier, year-round shelter for homeless adults; 32 beds for men, and eight for women.","Provided by Lookout Housing and Health Society69 other services offered by this agencyA low-barrier, year-round shelter for homeless adults; 32 beds for men, and eight for women.A low-barrier, year-round shelter for homeless adults; 32 beds for men, and eight for women. The Front Room provides services to residents only and include shower and laundry facilities, reading and television areas, telephone accessibility, and coffee. Lunch is available to residents at 12 noon, and dinner at 5 pm, seven days a week. Health-related services include 24-hour access to bed rest. A safe injection area and smoking tent are available from 1 pm to 3 pm daily; can provide medication storage as requested. Pets are welcome, but will be kept in cages. The Housing Program provides outreach and housing assistance. Can accommodate longer-term stays for individuals who have shown a commitment to finding housing. Referral accepted from self or other. First-come, first served; call for intake. Wheelchair accessible. Operated in partnership with and funded by BC Housing.",604-589-7777,N/A,surrey.shelter@lookoutsociety.ca,/result/gateway-shelter-9493226
Gateway of Hope Emergency Shelter,"5787 Langley Bypass, Langley, BC V3A 0A9",https://www.gatewayofhope.ca/gateway-services/emergency-shelter,Provides 32 emergency shelter beds for adults who are homeless or at risk of homelessness.,"Provided by The Salvation Army - BC Division221 other services offered by this agencyProvides 32 emergency shelter beds for adults who are homeless or at risk of homelessness.Provides 32 emergency shelter beds for adults who are homeless or at risk of homelessness. Accepts all genders; accommodation is in two dorms with 22 beds for masculine-identifying individuals and 10 beds for feminine-identifying individuals. Shelter guests are provided with three hot meals a day, as well as access to laundry, phone, advocacy, and housing registry. Health-related services include 24-hour access to bed rest, home nursing and home care through referral, and accommodation of oxygen tanks. Alcohol and drug use is not permitted on site. Intake hours are 24 hours a day; residents asked to stay on premises between 10 pm to 4 am. Two small pets can be accommodated at a time. Guests may store bikes, and use locker for storage. Wheelchair accessible. Also serves as an extreme weather shelter and warming centre where people can take refuge during severe weather.",604-514-7375,N/A,info@salvationarmy.ca,/result/gateway-of-hope-emergency-shelter-9510062
Gateway of Hope Relief Shelter,"5787 Langley Bypass, Langley, BC V3A 0A9",https://www.gatewayofhope.ca,Year-round shelter provides 30 mats for homeless adults or those at risk of homelessness.,"Provided by The Salvation Army - BC Division221 other services offered by this agencyYear-round shelter provides 30 mats for homeless adults or those at risk of homelessness.Year-round shelter provides 30 mats for homeless adults or those at risk of homelessness. New intakes begin at 10:15 pm. The shelter is open until 7 am, at which point guests are provided breakfast, then must leave the building by 9:30 am. Returning clients must return by 10 pm to keep their mat. One small pet permitted per individual, up to a maximum of two in the shelter in total. No storage provided. Wheelchair accessible.",604-514-7375,N/A,info@gatewayofhope.ca,/result/gateway-of-hope-relief-shelter-51903672
Goodacre Place Emergency Shelter,"3896 Railway Avenue, Smithers, BC V0J 2N3",https://www.scsa.ca,"Provides year-round, low-barrier, emergency housing for homeless adults of any gender.","Provided by Smithers Community Services Association (SCSA)20 other services offered by this agencyProvides year-round, low-barrier, emergency housing for homeless adults of any gender.Provides year-round, low-barrier, emergency housing for homeless adults of any gender. Services include daily meals, showers, laundry facilities, and referrals to community services. Pets are not allowed. Harm reduction focus. People may be admitted when intoxicated, but cannot use on the premises. Accepts inebriated individuals on condition of respectful behaviour. Violence will not be tolerated. Beds are allocated on a first-come, first-served basis. Referral accepted from self or other. Shelter is wheelchair accessible.",250-847-4660,N/A,general@scsa.ca,/result/goodacre-place-emergency-shelter-83207429
Guildford Shelter,"14716 104th Avenue, Surrey, BC V3R 1M3",https://lookoutsociety.ca,"A low-barrier, 24-hour shelter for homeless adults which offers 20 beds for men, eight beds for women, six couples suites, and six unisex beds in the lounge; accepts transgender individuals.","Provided by Lookout Housing and Health Society69 other services offered by this agencyA low-barrier, 24-hour shelter for homeless adults which offers 20 beds for men, eight beds for women, six couples suites, and six unisex beds in the lounge; accepts transgender individuals.A low-barrier, 24-hour shelter for homeless adults which offers 20 beds for men, eight beds for women, six couples suites, and six unisex beds in the lounge; accepts transgender individuals. There is a separate men's and women's area. Provides three meals a day plus snacks. Has shower and laundry facilities and lockers. Health-related services include medication management, home nursing through referral, home care through referral, and oxygen tank storage. Pets are welcome. Wheelchair accessible. Cannot accommodate carts. Operated in partnership with and funded by BC Housing and by the City of Surrey.",778-293-0889,N/A,Guildfordshelter@lookoutsociety.ca,/result/guildford-shelter-45758432
