Shelter Name,Address,Website,ResultCard Description,ResultCard Description Full,Phone 1,Phone 2,Email,Map Link
Second Avenue Shelter,"1151 2nd Avenue, Prince George, BC V2L 3B1",https://www.pgnfc.com,"Temporary emergency shelter provides 30 beds for homeless adults age 19 and over until March 31, 2025.","Provided by Prince George Native Friendship Centre (PGNFC)28 other services offered by this agencyTemporary emergency shelter provides 30 beds for homeless adults age 19 and over until March 31, 2025.Temporary emergency shelter provides 30 beds for homeless adults age 19 and over until March 31, 2025. Offers coffee, meals, snacks, laundry services, and telephone access at House of Friendship; shower facilities are located at the shelter and House of Friendship. Bin storage is available for personal items overnight at the shelter, with longer-term bin storage at House available at House of Friendship. There is no room for bikes or carts. Pets are not allowed. Wheelchair accessible. Daily intake is on a first-come, first-serve basis at 8 pm; individuals can sign up for the week. Winter hours are 8 pm to 10 am from beginning October to end of May, and summer hours are from 10 pm to 10 am beginning of June to end September. Funded by BC Housing.",250-563-0895,N/A,N/A,/result/second-avenue-shelter-81986477
Shelter,No  address available,https://www.southcariboo.cmha.bc.ca,Emergency shelter in motel rooms for homeless adults of all genders and homeless families.,"Provided by Canadian Mental Health Association (CMHA) - South Cariboo Branch11 other services offered by this agencyEmergency shelter in motel rooms for homeless adults of all genders and homeless families.Emergency shelter in motel rooms for homeless adults of all genders and homeless families. Shower and laundry facilities are available; meals are not provided. Provides information and referrals to community services and assists tenants to create a transition plan during their stay. Intake is 24 hours a day, seven days a week. Wheelchair accessible. Can accommodate pets on a case-by-case basis.",250-706-7599,N/A,marnie.jensen@cmhasouthcariboo.org,/result/shelter-65207380
Shelter Services,"99 3rd Avenue South, Williams Lake, BC V2G 1J1",https://cariboofriendshipsociety.ca/social-services,24-hour shelter provides 30 beds to transients and to those in crisis situations who are temporarily without housing; includes a family unit that takes women with children.,"Provided by Cariboo Friendship Society13 other services offered by this agency24-hour shelter provides 30 beds to transients and to those in crisis situations who are temporarily without housing; includes a family unit that takes women with children.24-hour shelter provides 30 beds to transients and to those in crisis situations who are temporarily without housing; includes a family unit that takes women with children. Also accepts people who are in supportive recovery, pre- and post-detox, pre-and post-treatment, and those with concurrent disorders; client must be able to care for themselves, and substance use is not permitted onsite. Provides meals, referrals, transportation, housing search, access to telephone, and resume preparation. Maximum length of stay is generally 30 days. Limited storage is available. Wheelchair accessible. Can not accommodate pets, but will assist in finding alternative arrangements. Funded by Aboriginal Housing Management Association.",250-398-6831 or 250-398-6821,N/A,admin@cfswl.ca,/result/shelter-services-9501986
Shelter and Street Help Line,No  address available,https://https://bc.211.ca,"Provides free, confidential, multilingual information and referral to people who are affected by homelessness in the Metro Vancouver, Fraser Valley, and Greater Victoria areas.","Provided by United Way BC Helpline Services9 other services offered by this agencyProvides free, confidential, multilingual information and referral to people who are affected by homelessness in the Metro Vancouver, Fraser Valley, and Greater Victoria areas.Provides free, confidential, multilingual information and referral to people who are affected by homelessness in the Metro Vancouver, Fraser Valley, and Greater Victoria areas. Covers a wide variety of services including shelters, food, and other services to address the wide range of circumstances that can result in homelessness. Also publishes the Shelter List twice a day, seven days a week, with details about available shelter beds and mats for women, men, youth and families; the list is updated twice a day at around 11:30 am and 7:30 pm, and can be accessed on the website (https://bc.211.ca/shelter-lists). Telephone assistance, text messaging, and web chat (bc.211.ca/chat) are available 24 hours, seven days a week.",2-1-1,2-1-1,211-help@uwbc.ca,/result/shelter-and-street-help-line-9505683
Shelter at the Travelodge,"1417 Cranbrook Street North, Cranbrook, BC V1C 3S7",N/A,"A 24-hour, low-barrier, year-round shelter provides shelter for homeless individuals of any gender age 19 and over; 53 single-occupancy rooms.","Provided by Community Connections Society of Southeast BC20 other services offered by this agencyA 24-hour, low-barrier, year-round shelter provides shelter for homeless individuals of any gender age 19 and over; 53 single-occupancy rooms.A 24-hour, low-barrier, year-round shelter provides shelter for homeless individuals of any gender age 19 and over; 53 single-occupancy rooms. There are also 17 overnight rooms; individuals should arrive onsite at 4 pm each day to see if a room is available. They then have access to the room until 10 am the following morning. All residents must remain in their rooms or on the property from 11 pm to 5 am. Provides breakfast and dinner, laundry and shower facilities, and assistance with finding housing. No carts and no pets allowed. One bag of personal belongings is accepted; small storage lockers may be available at the Salvation Army. Not wheelchair accessible, although some rooms are on the ground floor. Funded by BC Housing.",778-687-1707,N/A,shelterstaff@ccssebc.com,/result/shelter-at-the-travelodge-75409947
SisterShelter,"131 Dunlevy, Vancouver, BC",N/A,Low-barrier shelter provides eight bunk beds for up to 16 beds for women and those who self-identify as female.,"Provided by Atira Women's Resource Society53 other services offered by this agencyLow-barrier shelter provides eight bunk beds for up to 16 beds for women and those who self-identify as female.Low-barrier shelter provides eight bunk beds for up to 16 beds for women and those who self-identify as female. Open 6 pm to 9 am, seven days a week. Offers hot meals and snacks. Pets are accepted, but with restrictions. No storage. Partially wheelchair accessible; acceptable for clients with walkers or canes.",604-602-9463,N/A,sistersshelter@atira.bc.ca,/result/sistershelter-53746864
Springhouse Emergency Shelter,"333 East 16th Avenue, Vancouver, BC V5T2T7",https://www.thebloomgroup.org/our-work/women-children,"Provides year-round, 24-hour emergency housing for single self-identified adult women and women-led families; accepts male children 18 and under, and houses families in their own room.","Provided by The Bloom Group13 other services offered by this agencyProvides year-round, 24-hour emergency housing for single self-identified adult women and women-led families; accepts male children 18 and under, and houses families in their own room.Provides year-round, 24-hour emergency housing for single self-identified adult women and women-led families; accepts male children 18 and under, and houses families in their own room. Women are supported in retaining their autonomy, regaining their independence, and building skills to move forward in life. Services include meals, laundry, one-on-one support and advocacy, permanent housing search assistance, access to child and youth workers, and a family support specialist. Beds are available on a first-come, first-served basis. Pets may be considered on a case-by-case basis. Wheelchair accessible.",604-606-0420,604-606-0415,springhouse@thebloomgroup.org,/result/springhouse-emergency-shelter-9506516
Squamish Helping Hands Emergency Shelter,"37871 Third Avenue, Squamish, BC V8B 0A7",https://www.squamishhelpinghands.ca/programs-services/shelter-solutions,16-bed emergency shelter for adults of all genders ages 19 and over who are homeless or at risk of homelessness.,"Provided by Squamish Helping Hands Society3 other services offered by this agency16-bed emergency shelter for adults of all genders ages 19 and over who are homeless or at risk of homelessness.16-bed emergency shelter for adults of all genders ages 19 and over who are homeless or at risk of homelessness. Open 24 hours a day, seven days a week; intake is 24/7 as long as shelter is not full. One locker per person is available during shelter stay. Maximum stay is 30 days. Low-barrier shelter; drug or alcohol use within shelter or drop-in is not tolerated. Wheelchair accessible. Pets are not permitted in the shelter; outdoor cages are available. Extra space is being provided during an Extreme Weather Response (EWR) alert.",604-390-3000,N/A,info@shhs.ca,/result/squamish-helping-hands-emergency-shelter-79335521
St John the Divine Shelter,"St. John the Divine Anglican Church, 1611 Quadra,Victoria, BC V8W 2L5",https://solidvictoria.org,Provides year-round overnight emergency shelter for 30 adults of all genders.,"Provided by SOLID Outreach Society2 other services offered by this agencyProvides year-round overnight emergency shelter for 30 adults of all genders.Provides year-round overnight emergency shelter for 30 adults of all genders. Serves meals and snacks. Wraparound service includes peer support, system navigation assistance, and referrals to community resources. Not wheelchair accessible, nor able to accept pets. Hours are 9 pm to 8 am daily; gates open at 8 pm.",778-751-8296,N/A,jamessarasin9972@gmail.com,/result/st-john-the-divine-shelter-88285170
St Peter's Winter Shelter,"301 Machleary Street, Nanaimo, BC V9R 2G8",https://www.nflabc.org/the-st-peters-winter-shelter,Temporary low-barrier emergency shelter offering 25 beds for adults.,Provided by Nanaimo Family Life Association8 other services offered by this agencyTemporary low-barrier emergency shelter offering 25 beds for adults.Temporary low-barrier emergency shelter offering 25 beds for adults. Hours are 8 pm to 7:30 am daily. Operates from November 1 until March 31. Guests are asked to enter through the back laneway. Evening meals and breakfasts served. Does not accept pets. Wheelchair accessible. Offered in partnership with Connective Support Society - Nanaimo. Funded by BC Housing.,778-269-3212,N/A,wintershelter@nflabc.org,/result/st-peters-winter-shelter-59770152
Stepping Stones Emergency Shelter,"816 Vernon Street, Nelson, BC V1L 4G4",https://nelsoncares.ca/portfolio-items/stepping-stones/?portfolioCats=9,24-hour emergency shelter offers 17 beds in five bunk-style bedrooms for adults of any gender.,"Provided by Nelson CARES Society14 other services offered by this agency24-hour emergency shelter offers 17 beds in five bunk-style bedrooms for adults of any gender.24-hour emergency shelter offers 17 beds in five bunk-style bedrooms for adults of any gender. Offers three daily meals, showers, and information and referral regarding other community services. Staff are on site 24 hours a day, seven days a week. Low-barrier shelter, drug and alcohol free; maximum stay 30 days. Serves the Kootenay region. Partially wheelchair accessible. Funded in part by BC Housing.",250-352-9876,N/A,steppingstones@nelsoncares.ca,/result/stepping-stones-emergency-shelter-9510164
Stevenson House,"32 Elliot Street, New Westminster, BC V3L 2K1",https://salvation-army-stevenson-house.business.site,Year-round shelter provides up to 14 emergency shelter beds in dorm rooms for men 19 years and over.,"Provided by The Salvation Army - BC Division221 other services offered by this agencyYear-round shelter provides up to 14 emergency shelter beds in dorm rooms for men 19 years and over.Year-round shelter provides up to 14 emergency shelter beds in dorm rooms for men 19 years and over. Not a drop-in shelter, as registration and intake is required; for bed availability and intake, call after 4 pm Monday to Friday. Provides three daily meals, case management services, and outreach to accompany and help clients connect to services. Clients can register to stay for up to 30 nights. 11 pm curfew is enforced. Shelter residents can access their bed for bed rest with approval by management. Alcohol- and drug-free premise. Accepts referral from self or other. Lockers are provided for storage of personal effects. Shelter is not wheelchair accessible, and cannot accommodate pets.",604-526-4783,N/A,sh-shelter@outlook.com,/result/stevenson-house-9506461
Stuart Lake Shelter and Support Society,"New Caledonia Motel, 167 Douglas Avenue,Fort St James, BC V0J 1P0",https://www.slsss.org,Provides seasonal low-barrier overnight emergency shelter on mats for 10 adults in five rooms.,Provides seasonal low-barrier overnight emergency shelter on mats for 10 adults in five rooms.Provides seasonal low-barrier overnight emergency shelter on mats for 10 adults in five rooms. Also offers an additional emergency space in the office. Serves daily meals. Personal belongings including substance use supplies must be stored in the office overnight. Pets cannot be accommodated. Not wheelchair accessible. Works in partnership with health care and RCMP services to assist people to shelter. Intake is first-come first-served from 7:30 pm to 9 pm. Checkout is between 8 am and 8:30 am. Nonprofit society.,778-978-7630,N/A,info@slsss.org,/agency-details/stuart-lake-shelter-and-support-society-88342481
Stuart Wood School Shelter,"245 St Paul Street, Kamloops, BC V2C 2J2",https://www.outofthecoldkamloops.com,Provides 25 emergency overnight shelter beds operating seven days a week.,"Provided by Out of the ColdProvides 25 emergency overnight shelter beds operating seven days a week.Provides 25 emergency overnight shelter beds operating seven days a week. Guests at the shelters have access to daily warm meals, hygiene facilities, referral to health programming, and around the clock staff. Not wheelchair accessible. Pets are allowed, and there is some limited storage for carts. Intake is first-come, first-served. Hours are 8 pm to 8 am daily. Offered in partnership with BC Housing.",250-682-4945,N/A,N/A,/result/stuart-wood-school-shelter-75423290
Sumas Shelter,"1821 Sumas Way, Abbotsford, BC V2S 4L5",https://lookoutsociety.ca,Year-round 24-hour shelter for adults of all genders ages 19 and over.,"Provided by Lookout Housing and Health Society69 other services offered by this agencyYear-round 24-hour shelter for adults of all genders ages 19 and over.Year-round 24-hour shelter for adults of all genders ages 19 and over. Provides 59 beds in individual rooms with shared common areas. Intake is by referral only; any community service provider can refer clients. This is not a low barrier shelter. Intakes are completed between 9 am and 5 pm unless pre-approved. Provides meals, snacks, clothing, showers, laundry, case planning, referrals to all community resources, hygiene supplies, and harm reduction supplies. Some units are wheelchair accessible. Can accommodate a limited number of pets. There is storage for bikes (guest needs to have their own bike lock), and space for no more than two large bags per guest; no carts.",604-334-4911,N/A,sumasshelter@lookoutsociety.ca,/result/sumas-shelter-90751857
Surrey Urban Mission Temporary Shelter,"10776 King George Boulevard, Surrey, BC V3T 2X7",https://www.sumsplace.ca/shelters,"A temporary, low-barrier emergency shelter provides 40 beds to self-identified men and women ages 19 and over.","Provided by Surrey Urban Mission Society (SUMS)13 other services offered by this agencyA temporary, low-barrier emergency shelter provides 40 beds to self-identified men and women ages 19 and over.A temporary, low-barrier emergency shelter provides 40 beds to self-identified men and women ages 19 and over. Services include meals, blankets, and home nursing on site on Tuesdays. 24-hour shelter with intake at 10 pm; intake is through Surrey Welcome Hub at 13545 King George Boulevard. Free beds are distributed on a lottery basis at 10 pm every evening. Wheelchair accessible. Pets are accepted if caged. No storage available. The space also is used for 15 Extreme Weather Response (EWR) mats, provided from 11 pm to 7 am, between November 1 and March 31 when weather is extreme.",604-581-5172,604-585-1023,info@sumsplace.ca,/result/surrey-urban-mission-temporary-shelter-38655702
Surrey Welcome Hub (SWH),"13545 King George Boulevard, Surrey, BC V3T 2V1",https://www.sumsplace.ca/shelters,Integrated community drop-in facility and 15-bed permanent shelter.,"Provided by Surrey Urban Mission Society (SUMS)13 other services offered by this agencyIntegrated community drop-in facility and 15-bed permanent shelter.Integrated community drop-in facility and 15-bed permanent shelter. Public washrooms and respite areas available 8 am to 11 pm daily. Shelter is for adults ages 19 and over. Wheelchair accessible, storage available. One pet is allowed in the shelter at a time. Shelter guests have access to meal, showers, harm reduction supplies, and overdose prevention site. Meals are served at 8 am to 9:30 am and 12 noon to 1:30 pm daily also welcome the community. Case work services available 8 am to 4 pm daily. Serves as intake for four shelters (Surrey Welcome Hub, SUMS Place, The Cove, and The Olive Branch). Intakes are at 10 am and 10 pm daily based on availability of beds. If beds are full, a lottery system will be used: guests must be at the hub at the stated times (names accepted for the lottery starting at 9:30 am and 9:30 pm). Names will be drawn as beds become available. This lottery process happens only when the number of guests looking for a bed exceeds the available beds. Transportation then provided to respective shelter. The hub is open from 8 am to 4 pm and from 6 pm to 11 pm daily.",604-585-1023,N/A,info@sumsplace.ca,/result/surrey-welcome-hub-swh-83211866
Temporary Shelter,"Diamond Head Hotel, Mission, BC V2V 6C7",https://missioncommunityservices.com,Low-barrier shelter with 32 individual rooms for adults.,"Provided by Mission Community Services Society (MCSS)35 other services offered by this agencyLow-barrier shelter with 32 individual rooms for adults.Low-barrier shelter with 32 individual rooms for adults. Accepts couples. Offers three meals a day, and laundry. Provides access to harm reduction supplies, and an overdose prevention area onsite. Staff assist with accessing support services, income assistance, treatment, and housing. Accepts pets. Wheelchair accessible. Must fill out an application form available online or through Haven in the Hollow shelter. Staffed 24 hours. Funded by BC Housing.",604-556-6251,N/A,info@missionmcss.com,/result/temporary-shelter-88329640
Temporary Shelter Program - Abbotsford,"2616 Ware Street, Abbotsford, BC V2S 3E5",https://cyruscentre.com/emergency-shelter,Emergency shelter offers 10 beds for young adults ages 19 to 24 of all genders.,"Provided by Cyrus Centre Ministries11 other services offered by this agencyEmergency shelter offers 10 beds for young adults ages 19 to 24 of all genders.Emergency shelter offers 10 beds for young adults ages 19 to 24 of all genders. Access to dinner service is at 6 pm daily, and a breakfast club from 8 am to 9 am Monday to Friday. May access other services such as showers, clothing, snacks, advocacy, and referral to community agencies during the day by appointment. Shelter hours are 8 pm to 8 am daily. Intake is 24 hours a day; accepts referral from self or other.",604-859-5773,N/A,admin@cyruscentre.com,/result/temporary-shelter-program-abbotsford-83208080
Temporary Shelter Program - Chilliwack,"45845 Wellington Avenue, Chilliwack, BC V2P 2E1",https://cyruscentre.com/emergency-shelter,Emergency shelter offers nine beds for young adults ages 19 to 24 of all genders.,"Provided by Cyrus Centre Ministries11 other services offered by this agencyEmergency shelter offers nine beds for young adults ages 19 to 24 of all genders.Emergency shelter offers nine beds for young adults ages 19 to 24 of all genders. Access to dinner service is at 6 pm daily, and a breakfast club from 9 am to 10 am Monday to Friday. May access other services such as showers and laundry facilities, clothing, snacks, advocacy, and referral to community agencies during the day by appointment. Shelter hours are 8 pm to 8 am daily. Intake is 24 hours a day; accepts referral from self or other.",604-795-5773,N/A,admin@cyruscentre.com,/result/temporary-shelter-program-chilliwack-83208412
Temporary Walton Shelter,"261B East Hastings Street, Vancouver, BC V6A 1P2",https://lookoutsociety.ca,"Provides low-barrier, overnight emergency housing on bunk beds and mats for 15 homeless adults of all genders, with separate spaces for men, women, and non-binary/non-gender conforming individuals.","Provided by Lookout Housing and Health Society69 other services offered by this agencyProvides low-barrier, overnight emergency housing on bunk beds and mats for 15 homeless adults of all genders, with separate spaces for men, women, and non-binary/non-gender conforming individuals.Provides low-barrier, overnight emergency housing on bunk beds and mats for 15 homeless adults of all genders, with separate spaces for men, women, and non-binary/non-gender conforming individuals. Services include breakfast at 5 am, snacks and beverages from 3:30 pm to 7 pm, and dinner at 7 pm. Also provides information and referral to community services. Storage space is limited; with no lockers or storage spaces, residents are limited to what can be on or under a bed; bikes and carts may be accommodated depending on availability of space. Pets are allowed; cats must be in a cat carrier, and dogs must be leashed, with their person at all times, and well behaved. Zero tolerance for drugs or alcohol use on the property. People may be admitted when intoxicated, but cannot use on the premises. Line up starts at 4 pm to be on list, and beds are allocated on a first-come, first-served basis at 7 pm. Last intake is by 9 pm, unless an individual on the list doesn't show by 10 pm curfew time. Referral accepted from self or other. Guest hours are 4 pm to 6 am, and shelter office hours are 3 pm to 7 am. No prescribed maximum stay. Shelter has limited wheelchair accessibility due to a front step, but is accessible for anyone that can navigate that front step and function independently. Funded by BC Housing.",604-688-9129 Local 104,N/A,N/A,/result/temporary-walton-shelter-80677621
Temporary Winter Shelter - Hope,"650 Old Hope Princeton Highway, Hope, BC V0X 1L4",https://hopetransition.org/emergency-shelter-program,A 20-bed trailer that acts as a temporary winter shelter open from November to March 31st for adults of any gender age 19 and older; 24-hour intake.,"Provided by Hope and Area Transition Society14 other services offered by this agencyA 20-bed trailer that acts as a temporary winter shelter open from November to March 31st for adults of any gender age 19 and older; 24-hour intake.A 20-bed trailer that acts as a temporary winter shelter open from November to March 31st for adults of any gender age 19 and older; 24-hour intake. Support services include assistance with income application forms, substance use services, access to Integrated Homelessness Action Response Teams (IHART), and referrals to mental health services and health professionals. Also provides homeless outreach services. Office hours are 9 am to 4 pm Monday to Friday. Funded by BC Housing.",604-869-7574,604-869-5111,info@hopetransition.org,/result/temporary-winter-shelter-hope-87322165
The Beacon Shelter,"108 East Hastings Street, Vancouver, BC V6A 1N4",https://www.vancouverharbourlightsa.ca/shelters,"Emergency shelter for 66 men (cisgender and transgender), open 24-hours, year-round.","Provided by The Salvation Army - BC Division221 other services offered by this agencyEmergency shelter for 66 men (cisgender and transgender), open 24-hours, year-round.Emergency shelter for 66 men (cisgender and transgender), open 24-hours, year-round. Intake hours are 8 am to 11 pm; guests are assessed at the door for access to the shelter. No reservations. Registered men must return by 10:30 pm bed check to keep their place. Behaviour-based, low-barrier shelter, with no alcohol or drug use on site. Offers access to housing support, case management, social programs, a computer lab, and healthcare. Lockers provided for storage of limited personal possessions; no storage for bikes or carts. Pets cannot be accommodated. Not wheelchair accessible.",604-646-6846,N/A,beacon@harbourlightbc.com,/result/the-beacon-shelter-9507145
