Shelter Name,Address,Website,ResultCard Description,ResultCard Description Full,Phone 1,Phone 2,Email,Map Link
1660 Shelter,"1660 East Hastings Street, Vancouver, BC V5L 1S6",https://www.vafcs.org,"Provides year-round, low-barrier, 24-hour emergency housing, with 65 beds for all genders ages 19 and up.","Provided by Vancouver Aboriginal Friendship Centre Society (VAFCS)5 other services offered by this agencyProvides year-round, low-barrier, 24-hour emergency housing, with 65 beds for all genders ages 19 and up.Provides year-round, low-barrier, 24-hour emergency housing, with 65 beds for all genders ages 19 and up. Services include breakfast and dinner, on-site showers, personal hygiene products, first aid, and access to local calling; can also act as a mailing address for incoming mail. Free clothing is offered when supplies are available. Bus tickets are available for essential appointments. Arrangements for SafeRide can be made for those that must leave the shelter and feel unsafe walking to their destination. A scheduled nurse, pediatric doctor and Indigenous healers visit the shelter on a biweekly basis. Residents have access to counselling through the agency when needed. Storage is limited to personal items that can fit into storage bins. Service animals and pets are welcome, but pets need to be on a leash preferably in a portable cage. Zero tolerance for drugs or alcohol on the property. Accepts inebriated individuals on condition of respectful behaviour. Zero-tolerance to harassment, intimidation, and violence of any form toward guests and staff.No maximum stay as long as residents follow the shelter guidelines. Sign-up begins at 3 pm daily on a first-come, first-served basis. Curfew is at 11 pm; guests must be off the premises by 10 am the following morning. Facility is wheelchair accessible. Office hours are 9 am to 5 pm Monday to Friday. Funded by BC Housing and the Aboriginal Housing Management Association (AHMA).",604-428-3625,604-423-6046 Local 409,shelter@vafcs.org,/result/1660-shelter-82848905
3030 Gordon - Shelter,"3030 Gordon Avenue, Coquitlam, BC V3C 2K7",https://www.raincityhousing.org/about/program,Year-round temporary shelter with 30 beds for adults of any gender ages 19 and over.,"Provided by RainCity Housing and Support Society49 other services offered by this agencyYear-round temporary shelter with 30 beds for adults of any gender ages 19 and over.Year-round temporary shelter with 30 beds for adults of any gender ages 19 and over. 24-hour staffing with support services include three meals per day, shower and laundry facilities, drop-in doctors and nurses providing wound and medical care, and other service providers as needed. Guests share a four-bed dorm with possibility of moving into a private room if space is available. Length of stay is 90 days. Storage for bicycles is available. Wheelchair accessible. Pets are allowed.",604-474-0435,N/A,3030front@raincityhousing.org,/result/3030-gordon-shelter-88349333
ARC Emergency Shelter,"Addictions and Rehabilitation Centre (ARC), 525 Johnson Street,Victoria, BC V8W 1M2",https://www.victoriaarc.org,Offers 42 emergency shelter beds for men (cisgender and transgender)and support services including drug and alcohol recovery.,Provided by The Salvation Army - BC Division221 other services offered by this agencyOffers 42 emergency shelter beds for men (cisgender and transgender)and support services including drug and alcohol recovery.Offers 42 emergency shelter beds for men (cisgender and transgender)and support services including drug and alcohol recovery. Not wheelchair accessible. Cannot accommodate pets. Intake hours are 1 pm to 6 pm. Calling in advance is welcomed. Funded by BC Housing.,250-384-3396 Local 1,N/A,brenda.wadey@salvationarmy.ca,/result/arc-emergency-shelter-67406039
Abbotsford Food for the Soul Project,"2155 McKenzie Road, Abbotsford, BC V2S 3Z9",https://www.fftsp.org,Provides a variety of services in Abbotsford for individuals age 18 and over with addictions or mental health issues.,"Provided by Food for the Soul Project Society1 other services offered by this agencyProvides a variety of services in Abbotsford for individuals age 18 and over with addictions or mental health issues.Provides a variety of services in Abbotsford for individuals age 18 and over with addictions or mental health issues. Also assists those who are low income or experiencing homelessness. Services include free addictions counselling, primary care, groceries, clothing, housing and shelter referrals, and a volunteer-run support group for depression and/or anxiety. Hours are 10 am to 4 pm Monday to Friday.",604-746-9797,N/A,info@fftsp.org,/result/abbotsford-food-for-the-soul-project-72388303
Aboriginal Shelter,"201 Central Street, Vancouver, BC V6A 4A9",https://www.vafcs.org,An emergency low-barrier shelter that accommodates up to 55 men ages 19 and over.,"Provided by Vancouver Aboriginal Friendship Centre Society (VAFCS)5 other services offered by this agencyAn emergency low-barrier shelter that accommodates up to 55 men ages 19 and over.An emergency low-barrier shelter that accommodates up to 55 men ages 19 and over.  Accepts cisgender and transgender men. Open at 3 pm on a first-come, first-served basis; curfew is at 11 pm and shelter closes at 10 am. Provides a hot dinner around 6:15 pm, and a sandwich/snack for breakfast after 8 am. Also provides personal hygiene supplies. Storage available for 50 lbs or less of personal items; no space for storage of carts or bikes. Zero tolerance for violence or use of alcohol or illegal drugs. Pets are permitted in kennels on a case-by-case basis; aggressive dogs must be muzzled. Wheelchair accessible. Receives funding from BC Housing and City of Vancouver.",604-682-5556,N/A,201shelter@vafcs.org,/result/aboriginal-shelter-9505735
Aboriginal Youth Safehouse,No  address available,https://unya.bc.ca/programs/aboriginal-youth-safehouse,"A voluntary, short-term, live-in program for seven youth ages 16 to 18 of all backgrounds who do not have a safe place to stay.","Provided by Urban Native Youth Association (UNYA)22 other services offered by this agencyA voluntary, short-term, live-in program for seven youth ages 16 to 18 of all backgrounds who do not have a safe place to stay.A voluntary, short-term, live-in program for seven youth ages 16 to 18 of all backgrounds who do not have a safe place to stay. Youth workers connect residents to resources, assist with goal planning, and help youth move on to safe, stable, long-term housing, with new connections to community resources for ongoing stability and support. Provides meals and snacks; help finding work, training, and school programs; visits from counsellors and a nurse practitioner; support from UNYA’s Transition team; access to clothing and personal care items; bus tickets; and connection to Indigenous culture through teachings, arts and crafts, visits from Elders, and opportunities to learn about and participate in ceremony and smudging. Referrals accepted from youth or from service providers 24 hours a day, seven days a week.",604-254-5147,1-877-223-4321,safehouse.manager@unya.bc.ca,/result/aboriginal-youth-safehouse-9492983
Al Mitchell Place,"346 Alexander Street, Vancouver, BC V6A 1C3",https://lookoutsociety.ca,A 24-hour emergency centre that provides temporary accommodation and support to men who have no other housing options.,"Provided by Lookout Housing and Health Society69 other services offered by this agencyA 24-hour emergency centre that provides temporary accommodation and support to men who have no other housing options.A 24-hour emergency centre that provides temporary accommodation and support to men who have no other housing options. Also has 16 beds by referral only from Vancouver Coastal Health for patients who are leaving hospital and need a place to stay; women also accepted. In addition to meals and shelter, staff address issues such as housing, finances, and treatment for addiction or mental/physical ailments, through crisis counselling, case planning, and referral or liaison services. Health-related services include medication management, wound care, home care through referral, and oxygen tank storage. Pets are welcome. Wheelchair accessible.",604-681-9126,N/A,dtshelter@lookoutsociety.ca,/result/al-mitchell-place-9491929
Alexandra Gardner Women and Children Safe Centre,"1069 Gordon Drive, Kelowna, BC V1Y 3E3",https://www.nowcanada.ca/vendors,A low-barrier 20-bed homeless shelter for women (including transgender women) and their children; offers one family room.,"Provided by New Opportunities for Women (NOW) Canada Society8 other services offered by this agencyA low-barrier 20-bed homeless shelter for women (including transgender women) and their children; offers one family room.A low-barrier 20-bed homeless shelter for women (including transgender women) and their children; offers one family room. Services include counselling, case management, meals, laundry facilities, toiletries, clothing, and referrals to other community service providers and resources. Staffed 24 hours daily. Substance use is not permitted on site. Maximum length of stay is 90 days. Wheelchair accessible. Limited pets accepted.",250-763-2262,N/A,safecentre@nowcanada.ca,/result/alexandra-gardner-women-and-children-safe-centre-9505791
All Nations Youth Safe House (ANYSH),No  address available,https://www.frafca.org,"Safe house with six beds and meals for at-risk male, female, and transgender youth, ages 15 to 18, of all nations and ethnicities.","Provided by Fraser Region Aboriginal Friendship Centre Association (FRAFCA)13 other services offered by this agencySafe house with six beds and meals for at-risk male, female, and transgender youth, ages 15 to 18, of all nations and ethnicities.Safe house with six beds and meals for at-risk male, female, and transgender youth, ages 15 to 18, of all nations and ethnicities. Provides a supportive and nonjudgmental environment that empowers youth to define their own identity, achieve healthy self-determined goals, and create their own holistic state of well-being, while encouraging positive family and community connections. House is staffed 24 hours a day including holidays, but there is a nightly curfew. Youth must be working on goals, such as going to school, working, or reconnecting with family during their stay at the house; length of stay is seven to 30 days. Support services include provision of toiletries, access to a computer and phone, housing and job search form completion assistance, ongoing staff support, referrals to resources, and networking with other services. Amenities include a television, video games, and an iPad. Accepts referrals from self or other. No drug use at the safe house. No pets. Wheelchair accessible but with limited capacity. Funded by Ministry of Children and Family Development (MCFD), and licensed by Fraser Health Authority.",604-584-2625,N/A,samantha.work@frafca.org,/result/all-nations-youth-safe-house-anysh-9506737
Anchor of Hope Temporary Shelter,"119 East Cordova Street, Vancouver, BC V6A 1K8",https://www.vancouverharbourlightsa.ca/shelters,"Provides seasonal, low-barrier, overnight emergency housing on mats for 40 homeless adults of any gender (separate area for women) from October 1st to March 31st.","Provided by The Salvation Army - BC Division221 other services offered by this agencyProvides seasonal, low-barrier, overnight emergency housing on mats for 40 homeless adults of any gender (separate area for women) from October 1st to March 31st.Provides seasonal, low-barrier, overnight emergency housing on mats for 40 homeless adults of any gender (separate area for women) from October 1st to March 31st. Provides sandwiches and snack on intake, and coffee and bagged lunch in the morning. Behaviour-based, low-barrier shelter, with no alcohol or drug use on the premises. Services include information and referral, first aid, and support. Storage space for carts and bicycles is not available. Pets cannot be accommodated. Not wheelchair accessible. No maximum stay. Shelter hours are 9 pm to 7 am; no admissions past 1 am.",604-833-2142,N/A,anchor@harbourlightbc.com,/result/anchor-of-hope-temporary-shelter-9507969
Anderson Lodge Healing Centre for Women,No  address available,https://www.circleofeagles.com/sisters-lodge,"Provides temporary housing for homeless, at risk of homelessness, or chronically homeless Indigenous women.","Provided by Circle of Eagles Lodge Society (COELS)6 other services offered by this agencyProvides temporary housing for homeless, at risk of homelessness, or chronically homeless Indigenous women.Provides temporary housing for homeless, at risk of homelessness, or chronically homeless Indigenous women. Five beds are for women who need somewhere stable to live while they organize their life; they may be dealing with addiction, family violence, or other issues. Five beds function as a community residential facility designated for federally sentenced women who have been conditionally released to the community under the supervision of Correctional Service Canada (CSC). One bed is designated as an emergency bed with intake during business hours; referral required from a service provider (such as an outreach or support worker or counsellor). Services include counselling from an Elder, sweat lodges, and support in finding resources to assist with reintegration into society. Residents are required to be clean and sober, on time for curfew, phone to check in while out in the community, and not associate with men participating in the Circle of Eagles programs. 24-hour staff are available, with meals provided. Space includes seven single rooms and two double rooms. Stay is up to three years. Referral is through Ministry of Social Development and Poverty Reduction or from addiction services. Applicants must have at least 72 hours clean time to be eligible. Not wheelchair accessible, and no pets are allowed. Office hours are 8 am to 4 pm Monday to Friday. Receives funding from Lu'ma Native Housing Society.",604-874-1246,N/A,velmaa@coels.ca,/result/anderson-lodge-healing-centre-for-women-9507266
Association Advocating for Women and Community (AWAC),"144 George Street, Prince George, BC V2L 1P9",https://www.awaccommunityservices.org,Provides safe places for marginalized women and female youth.,"5 services offered by this service providerProvides safe places for marginalized women and female youth.Provides safe places for marginalized women and female youth. Operates a 24-hour Emergency Shelter with 40 beds for self-identified women 19 years of age and over. Shelters accept self-referrals. Intake for Outreach Support Services is through BC Housing's Homeless Outreach Program and can be completed from 8:30 am to 5 pm Monday to Friday. The shelter cannot accommodate pets. Also operates a Drop-In Centre with meals and phone access; shower/laundry facilities are for shelter residents only. A dedicated support person provides outreach to both men and women age 19 and over who are homeless, at risk of becoming homeless, or difficult to house. Provides help with obtaining identification and income assistance. Connects individuals to housing options by providing support with the application process; rent and utility subsidies may be available. Also provides information and referral to community resources, and accompaniment to appointments such as medical or court. Funded as a Homelessness Outreach Program (HOP) by BC Housing. Office hours are 8:30 am to 5 pm Monday to Friday. Funded by BC Housing, Northern Health, and Federal Government through Reaching Home. Nonprofit society, registered charity.",250-562-6262,N/A,info@awaccommunityservices.org,/agency-details/association-advocating-for-women-and-community-awac-9490685
Bartley Court Shelter West Kelowna,"2515 Bartley Court, West Kelowna, BC V1Z 2M8",https://www.turningpoints.ngo/continuum-of-care/shelter,"48-bed, all-gender inclusive shelter provides temporary housing for adults age 19 and over who are experiencing or at risk of homelessness or housing insecurity; open 24 hours a day, seven days a week.","Provided by Turning Points Collaborative Society27 other services offered by this agency48-bed, all-gender inclusive shelter provides temporary housing for adults age 19 and over who are experiencing or at risk of homelessness or housing insecurity; open 24 hours a day, seven days a week.48-bed, all-gender inclusive shelter provides temporary housing for adults age 19 and over who are experiencing or at risk of homelessness or housing insecurity; open 24 hours a day, seven days a week. Provides guests with meal services, showers, laundry, case planning, referrals to community services, and an overdose prevention site (OPS) on site; no alcohol consumption allowed on premises. Secure storage is available for belongings, and a registered storage area for bikes; shopping carts are not permitted. There is also a resource room available with books, games, and movies, as well as a bulletin board with employment and apartment rental notices. Wheelchair accessible. Pet friendly with a pet agreement. In-person registration takes places at 10 am, 4 pm, and 9 pm, on a first-come, first-served basis. Shelter diversion appointments are available between 2 pm and 4 pm Monday to Friday. During Extreme Weather Response (EWR) alerts, provides six emergency overflow mats between November 1 and March 31 when weather is extreme and a community alert is called. Funded by BC Housing.",778-583-4881,N/A,vanessa.kreway@turningpoints.ngo,/result/bartley-court-shelter-west-kelowna-83121059
Bay Avenue Shelter,"858 Ellis Street, Kelowna, BC V1Y 1H5",https://https://kelownagospelmission.ca,"Provides year-round, 24-hour emergency shelter with up to 65 pods for homeless adults age 19 and older; welcomes all genders.","Provided by Kelowna Gospel Mission Society9 other services offered by this agencyProvides year-round, 24-hour emergency shelter with up to 65 pods for homeless adults age 19 and older; welcomes all genders.Provides year-round, 24-hour emergency shelter with up to 65 pods for homeless adults age 19 and older; welcomes all genders. Services include three meals per day, shower and laundry facilities, personal hygiene products, clothing, counselling, access to local calls, referral to community services, and harm reduction services. Health-related services include 24-hour access to bed rest, daily pharmacy drop-off at the shelter, and home care through referral. Storage for one bike per resident is available, as well as two bins plus a locker for personal items. Allows one dog or cat per resident up to five maximum in the building. There is an overdose prevention site within the shelter as well as an inhalation outdoor site; accepts inebriated individuals on condition of respectful behaviour. Residents must be able to take care of themselves physically and mentally, and able to walk some stairs. Referral accepted from self or other. Intake hours are 8 am to 8 pm Monday daily and is on a first-come, first-served basis; accepts referral from self or other. Administration hours are 8 am to 4 pm Monday to Friday. Maximum stay is 90 days; extensions may be granted if participating in program goals. Not wheelchair accessible. Funded by BC Housing.",236-420-0899,250-763-3737,bayshelter@kelownagospelmission.ca,/result/bay-avenue-shelter-81798156
Belkin House Emergency Shelter for Men,"555 Homer Street, Vancouver, BC V6B 1K8",https://www.belkinhousesa.ca,"Year-round, 54-bed high barrier emergency shelter for men (cisgender, transgender, Two-spirit, and non-binary).","Provided by The Salvation Army - BC Division221 other services offered by this agencyYear-round, 54-bed high barrier emergency shelter for men (cisgender, transgender, Two-spirit, and non-binary).Year-round, 54-bed high barrier emergency shelter for men (cisgender, transgender, Two-spirit, and non-binary). Includes five beds for men referred by Community Court. Provides shared rooms and three meals per day. 24-hour shelter with intake at any time; clients must return by 11 pm to keep their bed. Shelter residents can access their bed for bed rest; a doctor's note may be required. Clients must be off the shelter floors between 7:45 am and 12:30 pm on weekdays; and between 8:45 am and 1 pm on weekends. Health-related services include home nursing and home care through referral, and accommodation of oxygen tanks (but no storage). Alcohol- and drug-free environment. Stay is 30 days, with potential for extensions on a case-by-case basis; there is a 60 day cool down period between stays. Wheelchair accessible. No pets; no bikes or scooters in the building. Client may not bring more than two bags of belongings and must keep their belongings in the lockers at all times; belongings left behind after discharge will be held for two weeks before disposal. Also operates an extreme weather response shelter between November 1 and April 15 when weather is extreme.",604-694-6636,604-681-3405,belkinhouse.maleshelter@salvationarmy.ca,/result/belkin-house-emergency-shelter-for-men-9492246
Belkin House Emergency Shelter for Women,"555 Homer Street, Vancouver, BC V6B 1K8",https://www.belkinhousesa.ca,"Year-round, 28-bed high barrier shelter providing emergency housing and three meals per day for women (cisgender and transgender) ages 19 and over, with or without children.","Provided by The Salvation Army - BC Division221 other services offered by this agencyYear-round, 28-bed high barrier shelter providing emergency housing and three meals per day for women (cisgender and transgender) ages 19 and over, with or without children.Year-round, 28-bed high barrier shelter providing emergency housing and three meals per day for women (cisgender and transgender) ages 19 and over, with or without children. This includes a bed for women referred by Community Court. Accommodation is in shared rooms for up to four women, or for a family. The shelter can accommodate two families; a family is considered as a mother and two children, including boys ages 10 and under; spouse may not stay with the family but may be accommodated in the Male shelter if there is availability. Intake is 24-hours a day; clients must return by 11 pm to keep their bed. Shelter residents can access their bed for bed rest; a doctor's note may be required. Clients must be off the shelter floors between 7:45 am and 12:30 pm on weekdays; and between 8:45 am and 1 pm on weekends. Health-related services include home nursing and home care through referral, and accommodation of oxygen tanks (but no storage). Alcohol- and drug-free environment. Stay is 30 days, with potential for extensions on a case-by-case basis. There there is a 60 day cool down period between stays. Wheelchair accessible. No pets; no bikes or scooters in the building. Also operates an extreme weather response shelter between November 1 and April 15 when weather is extreme.",604-694-6623,604-681-3405,belkinhouse.womenshelter@salvationarmy.ca,/result/belkin-house-emergency-shelter-for-women-9492512
Bill Reid Place - Emergency Housing,"17752 Colebrook Road, Surrey, BC V3Z 1C1",https://www.options.bc.ca/program/shelters-housing-services,"Provides year-round, low-barrier, 24-hour emergency housing for 16 homeless adults.","Provided by Options Community Services89 other services offered by this agencyProvides year-round, low-barrier, 24-hour emergency housing for 16 homeless adults.Provides year-round, low-barrier, 24-hour emergency housing for 16 homeless adults. May be able to accommodate a couple on a case-by-case basis and if space is available. Services include showers, laundry facilities, and meals. Health-related services include 24-hour access to bed rest, medication storage, and home care support (through referral); oxygen tanks are permitted. No maximum length of stay; residency is reevaluated on a week-to-week basis. 24-hour intake; it is recommended to call first to see if there is space available. No alcohol or drug use allowed on site, and violence is not tolerated. Pets are welcome on a case by case basis if space is available. Wheelchair accessible, with a 15-minute walk to the nearest bus stop. Funded by BC Housing.",604-574-4341,N/A,hyland.house@options.bc.ca,/result/bill-reid-place-emergency-housing-9493163
Bridge to Housing,"Samaritan Place, 702 Nicol Street,Nanaimo, BC V9R 4V1",https://www.islandcrisiscaresociety.ca/programs/samaritan-place,Offers seven units with two beds each for vulnerable single women in crisis.,"Provided by Island Crisis Care Society (ICCS)12 other services offered by this agencyOffers seven units with two beds each for vulnerable single women in crisis.Offers seven units with two beds each for vulnerable single women in crisis. Self referral/drop-in is possible for these beds, contingent on availability. Maximum length of stay is 30 days.",N/A,N/A,info@iccare.ca,/result/bridge-to-housing-88461714
